Product,Price Each,Quantity,Total Price
Bioglan Odourless Super Fish Oil Double Strength 200 Capsules,27.99,3,83.97
Blackmores Bio C 1000mg Vitamin C Immune Support 150 Tablets,20.99,2,41.98
Blackmores Evening Primrose Oil Skin Health Vitamin 190 Capsules,26.99,8,215.92
Carusos Total Beauty Collagen 60 Tablets NEW,17.47,1,17.47
CeraVe Hydrating Cleanser 236ml,13.39,1,13.39
Dr. LeWinn's Eternal Youth Day and Night Eye Cream 15g,34.97,1,34.97
Dr. LeWinn's Line Smoothing Complex Intensive Action Caviar Eye Serum 15ml,39.97,3,119.91
Dr. LeWinn's Private Formula Firming Eye Cream 30g,24.97,1,24.97
Dr. LeWinn's Reversaderm Corrective Skin Peel 30ml,19.97,1,19.97
Dr. LeWinn's Ultra R4 Eye Repair Cream 15g,37.47,1,37.47
Nature's Own Fish Oil 4 in 1 Concentrated with Omega 3 - 90 Capsules,17.99,2,35.98
Nature's Way Beauty Collagen 120 Tablets,24.99,3,74.97
Swisse Calcium + Vitamin D 300 Mini Tablets,17.99,5,89.95
Swisse Skincare Bio Ceramide Renewing Defence Cream 50g,12.99,1,12.99
Swisse Ultiboost Evening Primrose Oil 200 Capsules,27.99,2,55.98
Swisse Ultiboost Grape Seed 14250mg 300 Tablets,29.99,1,29.99
Swisse Ultiboost Zinc+ 60 Tablets,12.99,2,25.98
Blackmores Odourless Fish Oil 1000mg Omega-3 400 Capsules,40.49,1,40.49
Blackmores Vitamin E 1000IU Cholesterol Health 100 Capsules,37.99,2,75.98
Swisse Ultiboost Liver Detox 120 Tablets,23.99,2,47.98
Swisse Ultiboost Liver Detox 200 Tablets,30.99,1,30.99
